link,query,name,industry,location,description,website,size,logo,specialities,yearFounded,linkedinID,employeesOnLinkedIn,timestamp,RelatedCompany1LinkedInURL,RelatedCompany1Name,RelatedCompany1Sector,RelatedCompany1EmployeesRange,RelatedCompany2LinkedInURL,RelatedCompany2Name,RelatedCompany2Sector,RelatedCompany2EmployeesRange,RelatedCompany3LinkedInURL,RelatedCompany3Name,RelatedCompany3Sector,RelatedCompany3EmployeesRange,RelatedCompany4LinkedInURL,RelatedCompany4Name,RelatedCompany4Sector,RelatedCompany4EmployeesRange,RelatedCompany5LinkedInURL,RelatedCompany5Name,RelatedCompany5Sector,RelatedCompany5EmployeesRange,RelatedCompany6LinkedInURL,RelatedCompany6Name,RelatedCompany6Sector,RelatedCompany6EmployeesRange,invalidResults
https://www.linkedin.com/company/genworth-financial_2,https://www.linkedin.com/company/genworth-financial_2,Genworth,Insurance,"Richmond, VA","Genworth Financial, Inc. is a leading insurance holding company committed to helping families achieve the dream of home ownership and address the financial challenges of aging through its leadership positions in mortgage insurance and long term care insurance. Headquartered in Richmond, Virginia, Genworth traces its roots back to 1871. 

Our products and services are offered through financial intermediaries, advisors, independent distributors and sales specialists.",http://www.genworth.com/,"5,001-10,000 employees",https://media.licdn.com/dms/image/C4D0BAQHtb1Fp9a2vGg/company-logo_200_200/0?e=1548288000&v=beta&t=dEACPgP-YtgKZ10AjtV5tuN7Sw8ksG0pKJQrt-DhA24,,2004,"369633,3835866",5101,2018-10-19T06:10:31.883Z,https://www.linkedin.com/company/genworth-mortgage-insurance/,Genworth Mortgage Insurance,,201-500 employees,https://www.linkedin.com/company/genworth-financial-canada/,Genworth Canada,,201-500 employees,https://www.linkedin.com/company/genworth-2/,Genworth Australia,,201-500 employees,https://www.linkedin.com/company/canada-mortgage-and-housing-corporation/,Canada Mortgage and Housing Corporation (CMHC) Société canadienne d'hypothèques et de logement(SCHL),,"1,001-5,000 employees",https://www.linkedin.com/company/canada-guaranty-mortgage-insurance-company/,Canada Guaranty Mortgage Insurance Company,,51-200 employees,https://www.linkedin.com/company/capital-one/,Capital One,,"10,001+ employees",
https://www.linkedin.com/company/grant-executive-search,https://www.linkedin.com/company/grant-executive-search,Grant Executive Search,Staffing and Recruiting,"Melbourne, Victoria","Grant Executive Search is a boutique executive search and recruitment company offering quality services to clients and candidates across Banking, Financial Services and Commerce & Industry

We have an exceptional track record of success in delivering complex mandates and in identifying and attracting top talent.

We operate in the executive mid-market typically in the range of $120K to $400K base salaries

We are known for our specialisation with in-depth knowledge and expertise and well-established networks and deep relationships within the following key areas: 


Strategy, M&A and Corporate Development
Corporate strategy & M&A/Corp Development roles in-house as well as well partnering with select prof services firms.

Product and Marketing 
Digital Marketing, Online & eCommerce, Product Management, Product Analysts,  Category Management.

Banking & Financial Services 
Investment Management, Equity Research, Risk & Compliance, Superannuation and Operations/Project Management

Data
Data Science, Analytics and Insights Managers, Robotics and AI.

Finance & Accountancy 
Recruiting Senior Finance Executives to CFO level.",http://www.grantexecutive.com.au/,2-10 employees,https://media.licdn.com/dms/image/C4E0BAQFGdD-ASgaUFg/company-logo_200_200/0?e=1548288000&v=beta&t=4-YsijrMXFB-1uyKpNbjPJW5dcZUZQp_UTkl7xVAryk,"Corporate and Institutional Banking, Investment Banking, Accounting and Finance, Operations and Transformation, Executive Recruitment, Executive Search, Digital, Strategy, Funds Management and Superannuation, Data Science and Analytics, Risk Management, Equity Research, and Investment Management",2008,1618516,6,2018-10-19T06:10:33.915Z,https://www.linkedin.com/company/six-degrees-executive/,Six Degrees Executive,,51-200 employees,https://www.linkedin.com/company/goddard-&-grant/,The Goddard & Grant Group of Companies,,2-10 employees,https://www.linkedin.com/company/325-consulting/,325 Consulting,,2-10 employees,https://www.linkedin.com/company/mckinsey/,McKinsey & Company,,"10,001+ employees",https://www.linkedin.com/company/robert-walters/,Robert Walters,,"1,001-5,000 employees",https://www.linkedin.com/company/quinn-allan/,Quinn Allan,,2-10 employees,
https://www.linkedin.com/company/herbert-smith-freehills,https://www.linkedin.com/company/herbert-smith-freehills,Herbert Smith Freehills,Law Practice,"London, Greater London","Herbert Smith Freehills is one of the world’s leading professional services businesses, bringing together the best people across our 27 offices, to meet all your legal services needs globally. We can help you realise opportunities while managing risk.

Understanding your requirements, objectives and operating environment is important to us - we listen and take time to do this. You have ready access to our deep global sectoral expertise, as well as our local market understanding, to help you achieve your commercial objectives.

Operating as a single, globally integrated partnership, we work as a team, using innovative systems and processes to ensure your work is delivered intelligently, efficiently and reliably. We care about the markets and communities we work within and constantly strive to make them better.

What does it all add up to? When you work with Herbert Smith Freehills, you are partnering with a world-class and diverse team of client focused professionals who can ensure you achieve your best results.

Diversity & Inclusion

We aim to have a diverse, innovative culture where high performance, client focus and highly engaged people are our differentiator and where we celebrate the uniqueness of our people. 

We understand that our people have commitments and personal interests outside of work and we strive to create an agile working environment based on mutual trust and respect, in which people can perform at their best whilst maintaining sustainable balance across their work and non-work lives.


Sectors
Agribusiness, banks and other financial institutions, consumer products, energy, financial buyers, government and public sector, infrastructure, leisure and sport, manufacturing and industrials, mining, pharmaceuticals and healthcare, professional services and business services, real estate and technology, media and telecommunications.",http://www.herbertsmithfreehills.com/,"1,001-5,000 employees",https://media.licdn.com/dms/image/C4E0BAQHPX2NjeV8IoA/company-logo_200_200/0?e=1548288000&v=beta&t=up0p9bgAIpyItvweWZni5VDMbu8MKq4Y-Y25CrGCiiQ,"Anti-trust and competition, Capital markets, Compliance and regulatory, Dispute resolution, Projects and infrastructure, Real estate and tax, Employment, pensions and incentives, Environment and planning, Finance, Intellectual property, Investigations, and M&A",2012,7278,5176,2018-10-19T06:10:36.339Z,https://www.linkedin.com/company/allen-&-overy/,Allen & Overy,,"1,001-5,000 employees",https://www.linkedin.com/company/clifford-chance-llp/,Clifford Chance,,"5,001-10,000 employees",https://www.linkedin.com/company/allenslawfirm/,Allens,,"1,001-5,000 employees",https://www.linkedin.com/company/ashurst/,Ashurst,,"1,001-5,000 employees",https://www.linkedin.com/company/nortonrosefulbright/,Norton Rose Fulbright,,"5,001-10,000 employees",https://www.linkedin.com/company/king-and-wood-mallesons/,King & Wood Mallesons,,"1,001-5,000 employees",
https://www.linkedin.com/company/hesta-superannuation,https://www.linkedin.com/company/hesta-superannuation,HESTA,Financial Services,"Melbourne, VIC","HESTA is the industry super fund for health and community services. Since 1987, HESTA has grown to become the largest super fund dedicated to this sector.

HESTA has a history of strong, long-term returns. We keep fees low, and we don’t pay commissions to financial advisers.

We're also committed to providing outstanding member benefits, and helping members take control of their future with quality education and advice about super. 

The Board is made up of representatives from the industry’s employer and employee organisations. This helps us to make sure we continue to provide super education and advice services that are relevant to our members'​ particular needs.



General information
We’ll do our best to ensure the postings on our page are workplace appropriate. Since we can’t monitor every posting or conversation, we expect users will not post content that falls into the following categories & reserve the right to remove postings that are:
•	abusive, defamatory, or obscene
•	fraudulent, deceptive or misleading
•	in violation of any intellectual property right of another
•	in violation of any law or regulation
•	otherwise offensive
•	suggestive of or promoting third-party products or services.

While we actively monitor activity on this page you may prefer to communicate directly. Please call 1800 813 327 or email hesta@hesta.com.au 

Disclaimer: It’s important to note that comments on this page are not the opinions of H.E.S.T. Australia Ltd, nor do we confirm their accuracy. 

All information provided by LinkedIn is handled in accordance with our privacy policy https://www.hesta.com.au/privacy-policy.html

© Issued by H.E.S.T. Australia Ltd ABN 66 006 818 695 AFSL No. 235249, the Trustee of Health Employees Superannuation Trust Australia (HESTA) ABN 64 971 749 321.",http://www.hesta.com.au/,51-200 employees,https://media.licdn.com/dms/image/C4E0BAQEyDyqK6Zxk3w/company-logo_200_200/0?e=1548288000&v=beta&t=hRh0d0xaULRbMtKp8oyMmfLxFaSyAtydA4HlqID8sFo,,,756879,225,2018-10-19T06:10:38.253Z,https://www.linkedin.com/company/cbus-super-fund/,Cbus Super Fund,,201-500 employees,https://www.linkedin.com/company/hostplus/,Hostplus,,201-500 employees,https://www.linkedin.com/company/australiansuper/,AustralianSuper,,201-500 employees,https://www.linkedin.com/company/first-state-super/,First State Super,,201-500 employees,https://www.linkedin.com/company/unisuper/,UniSuper,,"501-1,000 employees",https://www.linkedin.com/company/caresuper/,CareSuper,,51-200 employees,
https://www.linkedin.com/company/hostplus,https://www.linkedin.com/company/hostplus,Hostplus,Financial Services,"Melbourne, VIC","We’re the industry superannuation fund for the hospitality, tourism, recreation and sport industries.

We’re passionate about providing our members and employers with the best possible products and services and are constantly looking for new ways to give our members better value. That’s why Hostplus is different. And different must be good because we’re one of Australia’s largest super funds. We have around one million members, 130,000 employers and over $24 billion in funds under management.

Our ongoing mission is to contribute to the financial growth and security of members and their families during their working years, and maximise their financial wellbeing in retirement.

Find out more: http://hostplus.com.au/",http://www.hostplus.com.au/,201-500 employees,https://media.licdn.com/dms/image/C510BAQHnG2KDq56o6Q/company-logo_200_200/0?e=1548288000&v=beta&t=gQ2b3vVShZmg1BgyyIwhuXojRPu8HQ06AFFNqpjPLhw,Superannuation,1987,102494,215,2018-10-19T06:10:40.196Z,https://www.linkedin.com/company/hesta-superannuation/,HESTA,,51-200 employees,https://www.linkedin.com/company/australiansuper/,AustralianSuper,,201-500 employees,https://www.linkedin.com/company/cbus-super-fund/,Cbus Super Fund,,201-500 employees,https://www.linkedin.com/company/caresuper/,CareSuper,,51-200 employees,https://www.linkedin.com/company/vicsuper/,VicSuper,,201-500 employees,https://www.linkedin.com/company/unisuper/,UniSuper,,"501-1,000 employees",
https://www.linkedin.com/company/iag,https://www.linkedin.com/company/iag,IAG,Insurance,"Sydney, NSW","IAG is Australia and New Zealand's largest general insurance company with a purpose to make your world a safer place, whether you are a customer, partner, employee, shareholder or part of the communities IAG serves across Australia, New Zealand and Asia.

Our businesses have helped people recover from natural disasters, accidents and loss since 1851. We operate in Australia, New Zealand, Thailand and Vietnam, providing insurance under many leading brands, including NRMA Insurance, CGU, SGIO, SGIC, WFI and Lumley Insurance (Australia); NZI, State, AMI and Lumley Insurance (New Zealand); Safety and NZI (Thailand); and AAA Assurance (Vietnam).  We also have interests in general insurance joint ventures in Malaysia and India. 

Increasingly, we see our role extending beyond paying claims to increasing awareness of risk, and helping communities reduce and prevent risk. We believe it is our responsibility as an industry leader to use our influence and role as a major investor, purchaser and employer for the good of everyone.

For further information please visit www.iag.com.au.",http://www.iag.com.au/,"10,001+ employees",https://media.licdn.com/dms/image/C4E0BAQGtj5VPQrYJ3w/company-logo_200_200/0?e=1548288000&v=beta&t=KLQuIKoEPoH_mMLHjWEvruZjZZFqrW36RZUgwOECbbk,"Underwriting, Home & Motor Claims, CTP, Life Insurance, Travel Insurance, Boat, Lifestyle & Leisure Insurance, Home Security, Risk, Reinsurance, and Shared Value",,"3687,283921,1405068,3629084",10090,2018-10-19T06:10:42.114Z,https://www.linkedin.com/company/suncorp/,Suncorp Group,,"10,001+ employees",https://www.linkedin.com/company/qbe/,QBE Insurance,,"10,001+ employees",https://www.linkedin.com/company/cgu/,CGU Insurance,,"1,001-5,000 employees",https://www.linkedin.com/company/commonwealthbank/,Commonwealth Bank,,"10,001+ employees",https://www.linkedin.com/company/anz/,ANZ,,"10,001+ employees",https://www.linkedin.com/company/westpac/,Westpac,,"10,001+ employees",
https://www.linkedin.com/company/ibm,https://www.linkedin.com/company/ibm,IBM,Information Technology and Services,"Armonk, New York, NY","At IBM, work is more than a job - it's a calling: To build. To design. To code. To consult. To think along with clients and sell. To make markets. To invent. To collaborate. Not just to do something better, but to attempt things you've never thought possible. To lead in this new era of technology and solve some of the world's most challenging problems.
 
IBM is a leading cloud platform and cognitive solutions company. Restlessly reinventing since 1911, we are the largest technology and consulting employer in the world, with more than 380,000 employees serving clients in 170 countries. With Watson, the AI platform for business, powered by data, we are building industry-based solutions to real-world problems. For more than seven decades, IBM Research has defined the future of information technology with more than 3,000 researchers in 12 labs located across six continents. For more information, visit www.ibm.com.
 
This is IBM's official LinkedIn account and it follows IBM Social Computing Guidelines. We reserve the right to delete comments that are offensive or suggestive, personal attacks, anonymous, wildly off-topic, spam or advertisements. For more information regarding IBM’s social computing guidelines, visit http://ibm.co/1LRDq6F",http://www.ibm.com/,"10,001+ employees",https://media.licdn.com/dms/image/C560BAQEZL5_LD7kuhg/company-logo_200_200/0?e=1548288000&v=beta&t=cxXHX7WAGmjZlCEGdLf5JMTIdZ-2hu1B0uqMYIz6VBQ,"Cloud, Mobile, Cognitive, Security, Research, Watson, Analytics, Consulting, Commerce, Experience Design, Internet of Things, Technology support, Industry solutions, Systems services, IT iinfrastructure, Resiliency services, and Financing",,"1009,291412",577138,2018-10-19T06:10:44.444Z,,,,,,,,,,,,,,,,,,,,,,,,,
https://www.linkedin.com/company/imc-financial-markets,https://www.linkedin.com/company/imc-financial-markets,IMC Trading,Capital Markets,"Amsterdam, Noord Holland","As one of the world’s leading market makers, IMC trades on more than 100 venues around the world and provides liquidity in more than 200,000 securities. Besides our on-screen market making in many asset classes globally, we are also a Designated Market Maker (DMM) on the New York Stock Exchange and our ETF desk in Europe leverages our experience, advanced technology and deep liquidity, to offer competitive pricing directly to qualified counterparties.
 
Across offices in Amsterdam, Chicago and Sydney, global teams of technologists and traders work together to design and develop the software, hardware, advanced networks and algorithms that drive our trading strategies and make us one of the world’s leading liquidity providers. We hire exceptional, insatiably curious problem-solvers and challenge them to anticipate change and continuously innovate in ways that will sustain our success. We recognize, and reward, the best ideas regardless of hierarchy. At IMC, anyone can make an impact and everyone is encouraged to do so.",http://www.imc.com/,"501-1,000 employees",https://media.licdn.com/dms/image/C4E0BAQFlJ-mWgngIjA/company-logo_200_200/0?e=1548288000&v=beta&t=GMeJwt1CqS-NExCFu2TWvZKmu-A0RUMf2pi7MlfuM7E,"Technology Driven Trading, Market Making, Technology, and Business Operations",1989,200030,503,2018-10-19T06:10:46.528Z,https://www.linkedin.com/company/optiver/,Optiver,,"501-1,000 employees",https://www.linkedin.com/company/flow-traders/,Flow Traders,,201-500 employees,https://www.linkedin.com/company/jump-trading-llc/,Jump Trading LLC,,201-500 employees,https://www.linkedin.com/company/imc-financial-markets--/,IMC Financial Markets,,2-10 employees,https://www.linkedin.com/company/imc/,IMC,,51-200 employees,https://www.linkedin.com/company/citadel-llc/,Citadel LLC,,"1,001-5,000 employees",
https://www.linkedin.com/company/ing-australia,https://www.linkedin.com/company/ing-australia,ING Australia,Banking,"Sydney, NSW","We exist to empower people to stay ahead, in business and in life. We’re proud to be part of ING Group, the world’s leading direct savings bank – and even prouder to be Australia’s most recommended bank. That’s because, for us, nothing matters more than being loved by our customers.

Since we started out in 1999, we’ve reinvented the way Australians do their banking by delivering products that are simple, and good value – from Everyday Banking and Savings, to straightforward Home Loans and Super. With our 24/7 customer care and digital platforms, we’ve also given customers support round the clock – plus the freedom to do their banking anywhere, anytime. 

The driving force behind all of this has been simple: our desire to improve our customers’ lives by doing things differently. Everyone here shares the same forward-thinking approach, and a genuine desire to make a difference to the communities we’re part of. 

If you’re ready to be challenged to achieve your full potential, we are the place to make it happen. Here, you’ll have the freedom to put ideas into action, own the results, collaborate on a global scale – and make a genuine difference to people’s lives. 

Like to find out more? Visit  ing.com.au or find us on social media:
Facebook - http://www.facebook.com/INGAust
Twitter - https://twitter.com/ING_Aust
YouTube - https://www.youtube.com/c/INGAUST
Our Blog - http://blog.ing.com.au/


ING is a business name of ING Bank (Australia) Limited ABN 24 000 893 292 AFSL 229823, Australian Credit Licence 229823. ING Living Super (which is part of the ING Direct Superannuation Fund ABN 13 355 603 448) is issued by Diversa Trustees Limited ABN 49 006 421 638, AFSL 235153. Any advice on this website does not take into account your objectives, financial situation or needs and you should consider whether it is appropriate for you.",http://www.ing.com.au/,"501-1,000 employees",https://media.licdn.com/dms/image/C560BAQGrOAc-iiOpOQ/company-logo_200_200/0?e=1548288000&v=beta&t=NvI_BAgq2evcxbE2Kgf38amrA2B7b2dIyreZRo6H7qM,,1999,387202,1070,2018-10-19T06:10:48.595Z,,,,,,,,,,,,,,,,,,,,,,,,,
https://www.linkedin.com/company/intercontinentalexchange-inc-,https://www.linkedin.com/company/intercontinentalexchange-inc-,Intercontinental Exchange,Financial Services,"Atlanta, GA","Intercontinental Exchange (NYSE: ICE) is a Fortune 500 company that operates global markets and clearing houses, and delivers information and technology designed to help companies around the world manage risk, access information and raise capital. We serve customers in over 70 countries with a team of world-class employees. We recruit passionate, knowledgeable professionals and offer a collaborative, results-oriented environment where they help build innovative solutions to help our customers thrive in global markets. 
 
For us, the mission is simple: to leverage technology and information to solve our customers’ problems with a relentless focus on efficiency and ingenuity.",http://www.intercontinentalexchange.com/,"1,001-5,000 employees",https://media.licdn.com/dms/image/C4D0BAQFwUX3H0ZzbAw/company-logo_200_200/0?e=1548288000&v=beta&t=wZdFUjZqdlN246fqHmjThHtoTqfnHqdGgGh11ay0zV0,,2001,"252398,164404,220123,8573",3854,2018-10-19T06:10:50.517Z,,,,,,,,,,,,,,,,,,,,,,,,,
https://www.linkedin.com/company/iress,https://www.linkedin.com/company/iress,IRESS,Computer Software,"Melbourne, Victoria","We design, develop and deliver technology for the financial services industry. Whether you're trading on global financial markets, managing investments, providing mortgages or helping your clients plan their financial future, you can rely on our software, and our team, to deliver real outcomes for your business and your clients.

Our complete end-to-end solutions enable you to engage and service clients across all channels, achieve operational efficiencies, make considered decisions, in addition to monitoring and managing risk. Our proven technology, expertise and implementation track record means that businesses of all sizes choose to partner with us - from the world's most iconic financial services brands to small business entrepreneurs.",http://www.iress.com/,"5,001-10,000 employees",https://media.licdn.com/dms/image/C4E0BAQHmw0PIGKI3mQ/company-logo_200_200/0?e=1548288000&v=beta&t=5mUQ-fYbbw56ybr0n8-e70YGUUjuasR9N9mYWXQqzBM,"Market Data, Order Management Systems, Portfolio management software, Wealth Management, Insurance Solutions, Remuneration management software, Private wealth management software, Order Routing, Mortgage software, Sourcing software, Financial planning software, Wealth Management software, Lending software, Trading software, Consultancy, Financial technology, and Software training",1993,10436,1670,2018-10-19T06:10:52.442Z,https://www.linkedin.com/company/financial-synergy/,Financial Synergy - Acquired by IRESS,,201-500 employees,https://www.linkedin.com/company/atlassian/,Atlassian,,"1,001-5,000 employees",https://www.linkedin.com/company/myob/,MYOB,,"1,001-5,000 employees",https://www.linkedin.com/company/national-australia-bank/,National Australia Bank,,"10,001+ employees",https://www.linkedin.com/company/intelliflo-ltd/,Intelliflo Ltd,,51-200 employees,https://www.linkedin.com/company/commonwealthbank/,Commonwealth Bank,,"10,001+ employees",
https://www.linkedin.com/company/jxt,https://www.linkedin.com/company/jxt,JXT Global,Internet,"Sydney, New South Wales","The #1 provider of cloud based digital marketing solutions for recruiters and HR departments.

JXT provides world-class digital technology solutions that provide real ROI and provide an ecosystem on which you build your digital brand.

JXT has over 600 recruiter brands across the digital universe from start-up recruiters to multi-national brands and now has 4 of the 6 largest recruitment agencies as clients.

The platform is underpinned with a propitiatory job board technology that we build into our clients’ websites granting them a best of breed job board solution that forms part of their own brand. A snapshot of what we provide to the recruitment industry:

· We integrate with the majority of database solutions; automating processes

· We build all of our solutions in responsive technology; harnessing candidates on mobile and tablet whilst on the move (including application forms)

· We fully integrate all social media platforms into our solution

· We build all of our solutions in line with best UX/UI and best-practice SEO development

· As all our sites sit on a SaaS platform they are continually evolving to digital landscape changes - keeping you ahead of your competition!

· Our platform is fully multi-regional and multi-lingual",http://www.jxt.com.au/,11-50 employees,https://media.licdn.com/dms/image/C510BAQGRG3c3VOuBIg/company-logo_200_200/0?e=1548288000&v=beta&t=Be0McxbMvFvV7XmJwFE_56-TqrZoIY0vj-kOYmwZyqc,"Custom web design, Job board technology, Mobile websites, Social Media, Social media training, Web development, Search Engine Optimization (SEO), Search Engine Marketing (SEM), Online Strategy Consulting, Recruitment Websites, Web Design, and Internet Marketing",2005,402565,56,2018-10-19T06:10:53.996Z,https://www.linkedin.com/company/jxt-group/,JXT Group,,2-10 employees,https://www.linkedin.com/company/volcanic/,Volcanic,,51-200 employees,https://www.linkedin.com/company/jxt-applications-inc/,jxt applications inc,,11-50 employees,https://www.linkedin.com/company/bullhorn/,Bullhorn,,"501-1,000 employees",https://www.linkedin.com/company/jobsjobsjobs-ltd/,JobsJobsJobs Ltd,,11-50 employees,https://www.linkedin.com/company/broadbean-technology/,Broadbean Technology,,201-500 employees,
