link,query,name,industry,location,description,website,size,logo,specialities,yearFounded,linkedinID,employeesOnLinkedIn,timestamp,RelatedCompany1LinkedInURL,RelatedCompany1Name,RelatedCompany1Sector,RelatedCompany1EmployeesRange,RelatedCompany2LinkedInURL,RelatedCompany2Name,RelatedCompany2Sector,RelatedCompany2EmployeesRange,RelatedCompany3LinkedInURL,RelatedCompany3Name,RelatedCompany3Sector,RelatedCompany3EmployeesRange,RelatedCompany4LinkedInURL,RelatedCompany4Name,RelatedCompany4Sector,RelatedCompany4EmployeesRange,RelatedCompany5LinkedInURL,RelatedCompany5Name,RelatedCompany5Sector,RelatedCompany5EmployeesRange,RelatedCompany6LinkedInURL,RelatedCompany6Name,RelatedCompany6Sector,RelatedCompany6EmployeesRange,invalidResults
https://www.linkedin.com/company/globalx,https://www.linkedin.com/company/globalx,GlobalX,Information Technology and Services,"Brisbane, Queensland","GlobalX is a fast moving technology company with operations across Australia, specialising in innovative software and legal support services used by legal, conveyancing, accounting and financial professionals.

Our leading software and online solutions enable organisations of all sizes to manage their time more effectively in the digital age.

With access to the most comprehensive range of online regulatory information, support services and technology tools, GlobalX solutions are intelligently connected with each other.  GlobalX services and software solutions are built to ensure practitioners meet their legislative responsibilities and compliance obligations.

With over 20 years industry experience GlobalX is a pioneer, being the first company to provide Australian land titles digitally online. Having recently won an award in Software Innovation in the coveted Australian Business Awards, GlobalX is now one of Australia’s most successful tech start-ups, offering professionals robust, yet refined workflow solutions and quality legal support services.

As GlobalX delivers innovative solutions to market with a digital focus, we continue to work collaboratively alongside peak industry bodies, innovators and end-users alike to ensure we develop new time-saving tools for the industry.

GlobalX has a rich history of innovation and industry firsts seen throughout the company’s history and growth. 

A privately owned and operated Australian technology business, GlobalX employs more than 250 staff across a network of five offices, headquartered from Brisbane, Queensland.

For more information on GlobalX products and services, contact one of our Account Managers on 1300 885 662.",http://www.globalx.com.au/,201-500 employees,https://media.licdn.com/dms/image/C560BAQEzJCSCXh-frQ/company-logo_200_200/0?e=1548288000&v=beta&t=ixTVsxfuFeCBclIsyKSd0GU55RHqI2yn9BSCKzLLgVk,"Information Searching (Property, Business & Consumer), Conveyancing and Legal Support Services, Software Solutions, In-field Legal Services, Conveyancing Software, and PEXA",1995,44471,141,2018-10-19T09:13:27.745Z,https://www.linkedin.com/company/pexa/,Property Exchange Australia Ltd (PEXA),,201-500 employees,https://www.linkedin.com/company/infotrack-pty-ltd/,InfoTrack Pty Ltd,,201-500 employees,https://www.linkedin.com/company/global-x-management-company/,Global X Management Company,,11-50 employees,https://www.linkedin.com/company/globalx-legal/,GlobalX Legal,,2-10 employees,https://www.linkedin.com/company/sympli-australia/,Sympli,,11-50 employees,https://www.linkedin.com/company/leap-legal-software/,LEAP Legal Software AU,,51-200 employees,
https://www.linkedin.com/company/go-nitro,https://www.linkedin.com/company/go-nitro,"Nitro, Inc.",Computer Software,"San Francisco, California","Nitro is a document productivity company. We make it possible for businesses to provide PDF productivity and eSignature tools to every user across the organization.

Founded in 2005 in Melbourne, Australia, Nitro is used by more than 650,000 businesses, including over half of the Fortune 500. Nitro headquarters are in San Francisco, with offices around the world. 

Accomplish more with documents and make work more productive at GoNitro.com.",https://www.gonitro.com/,201-500 employees,https://media.licdn.com/dms/image/C4E0BAQF0PxPe1smHeA/company-logo_200_200/0?e=1548288000&v=beta&t=YubxGgj35XINTiTcKTnCsXrgC9h0F-MQZ5TNSlHmhTc,"PDF productivity, Change management, eSigning for all, and User adoption",2005,76281,152,2018-10-19T09:13:29.826Z,https://www.linkedin.com/company/nitro/,Nitro,,11-50 employees,https://www.linkedin.com/company/nitro_2/,Nitro,,2-10 employees,https://www.linkedin.com/company/nitrosolutions/,Nitro Solutions,,11-50 employees,https://www.linkedin.com/company/mapbox/,Mapbox,,201-500 employees,https://www.linkedin.com/company/flow-kana/,Flow Kana,,201-500 employees,https://www.linkedin.com/company/salesforce/,Salesforce,,"10,001+ employees",
https://www.linkedin.com/company/halcyon-knights/,https://www.linkedin.com/company/halcyon-knights/,Halcyon Knights - Tech & Executive Talent,Staffing and Recruiting,"Melbourne, Victoria","Halcyon Knights is an Executive Search and Recruitment firm dedicated exclusively to the technology sector. Halcyon Knights commenced trading in March 2007 in Melbourne, Australia, and has now established 5 offices throughout Asia-Pacific, in Melbourne, Sydney, Canberra, Auckland and Singapore.

Our breadth of service spans the Information Technology sector, in both vertical and horizontal markets, broadly categorised as #Vendor, #Digital and #Technology, including #Cloud, #Data & #Analytics and #Cyber-Security. Working with clients and candidates throughout the APAC region, we are in fact Australia's largest dedicated technology vendor recruitment practice. 

Our team have a depth of knowledge and understanding in their areas of specialist recruitment markets and have a vast network of candidates who are actively seeking new opportunities, or who are open to being approached for career opportunities in their space.

We are proud to have been awarded  'Australia's Most Socially Engaged Enterprise Staffing Agency'​ by LinkedIn, offering our clients and candidates greater reach and exposure within the Asia Pacific region and beyond.

To keep up to date with what's happening in the IT sector throughout the Asia-Pacific region, follow us on LinkedIn, Twitter, Facebook, Google+, Instagram and YouTube, and register for job alerts via our websites: 

www.halcyonknights.com.au
www.halcyonknights.co.nz
www.halcyonknights.com.sg",https://www.halcyonknights.com.au/,11-50 employees,https://media.licdn.com/dms/image/C4E0BAQGoRugsArWo4Q/company-logo_200_200/0?e=1548288000&v=beta&t=U4wJj3-FOvupqgD5gOLaeXgwwFjcyfpBJAuU7ok73fg,"IT Executive Search & Permanent Recruitment, IT Vendor Recruitment, Commercial/Executive Recruitment, Digital Recruitment, Contract Recruitment, Executive Search, Technology recruitment, Cloud Recruitment, Data & Analytics Recruitment, Cyber-Security Recruitment, and IT Recruitment",2006,1336033,57,2018-10-19T09:13:31.799Z,https://www.linkedin.com/company/zack-group/,ZACK Group,,11-50 employees,https://www.linkedin.com/company/hays/,Hays,,"5,001-10,000 employees",https://www.linkedin.com/company/hudson/,Hudson,,"1,001-5,000 employees",https://www.linkedin.com/company/telstra/,Telstra,,"10,001+ employees",https://www.linkedin.com/company/xpand-group/,Xpand Group,,51-200 employees,https://www.linkedin.com/company/robert-walters/,Robert Walters,,"1,001-5,000 employees",
https://www.linkedin.com/company/hansencx,https://www.linkedin.com/company/hansencx,HansenCX,Computer Software,"Doncaster, Victoria","HansenCX (a Hansen Technologies Company) is a leading global provider of customer care, billing software and data management systems. With deep expertise, the flexibility and power of HansenCX products deliver a leading customer experience in four major industry sectors: energy (utilities), water, Pay-TV and telecommunications.",http://www.hansencx.com/,0-1 employees,https://media.licdn.com/dms/image/C4E0BAQE2C36ejuU6Ig/company-logo_200_200/0?e=1548288000&v=beta&t=UxsT7uJrx5vV48cFObKoXIWar5BkMQRCtYFbr5ce_qU,,,14391799,24,2018-10-19T09:13:33.759Z,https://www.linkedin.com/company/hansen-technologies/,Hansen Technologies,,"1,001-5,000 employees",https://www.linkedin.com/company/enoro/,Enoro,,201-500 employees,https://www.linkedin.com/company/southern-cross-computer-systems/,SXiQ,,51-200 employees,https://www.linkedin.com/company/formula-micro-a-s/,Formula Micro Bornholm A/S,,11-50 employees,https://www.linkedin.com/company/2ndc/,2ndC,,11-50 employees,https://www.linkedin.com/company/-jenhospitalet-danmark/,Øjenhospitalet Danmark,,11-50 employees,
https://www.linkedin.com/company/hotdoc,https://www.linkedin.com/company/hotdoc,HotDoc,Information Technology and Services,"Melbourne, VIC","HotDoc is Australia's leading patient engagement platform. We take pride in helping over 9,000 GPs across Australia boost patient loyalty and provide proactive, sustainable healthcare. 

Our products include: online bookings, automated recalls and reminders, patient check-in via mobile and touchscreen kiosk, online processing of repeat prescription requests, and Inform (a tool designed to prompt patients to take a proactive interest in preventive health and chronic disease management). 

HotDoc also provides monthly webinars where practice managers, doctors, nurses and medical receptionists can earn CPD points. The series was featured among the ‘Top 100 Healthcare Webinars in 2017’ on GoToWebinar.  Visit our blog to get involved.",http://www.hotdoc.com.au/,11-50 employees,https://media.licdn.com/dms/image/C510BAQHXtHE4Ss9OUg/company-logo_200_200/0?e=1548288000&v=beta&t=FYRveXMc0TEG_HvH4VRI3Gh6EC7e2UvsV2F2EHaXrTw,"Online Bookings, Recalls, Reminders, Check-in, Repeats, and Preventive health promotion",2012,2983815,60,2018-10-19T09:13:35.747Z,https://www.linkedin.com/company/healthengine/,HealthEngine,,51-200 employees,https://www.linkedin.com/company/papercloud/,Papercloud,,11-50 employees,https://www.linkedin.com/company/assetowl/,Asset Owl,,11-50 employees,https://www.linkedin.com/company/hotdocs-limited/,HotDocs Group,,51-200 employees,https://www.linkedin.com/company/airtree-ventures/,AirTree Ventures,,11-50 employees,https://www.linkedin.com/company/papercloud-ventures/,Papercloud Ventures,,2-10 employees,
https://www.linkedin.com/company/hsd-zipper,https://www.linkedin.com/company/hsd-zipper,HSD ZIPPER,Apparel & Fashion,"深圳, 广东","─HSD Shenzhen─
HSD zipper was founded at Shenzhen in 1991, is a leading zipper manufacturer in China. Specialize in the manufacture of coil, plastic and metal zippers. HSD Zipper operates a professional factory, using advanced technology for all our production processes from accepting raw materials up to finalizing finished goods.
─HSD Cambodia─
Our Cambodia factory opened in September 2014 and is located in Kampong Speu – approximately 40 kilometers from Cambodia’s capital - Phnom Penh.  With a total investment of more than three million dollars, the facility covers an area of two hundred and fifty thousand square meters.  As the only zipper factory in Cambodia, we are able to offer our customers shorter lead-times with more convenient service to meet the requirements of the international market.
─HSD Jiashan─
A new HSD branch factory in Jiashan is now preparing and will be opened in 2020. With a total investment of more than 50 million US dollars, the facility covers an area of forty  thousand square meters.  In the future, HSD Jiashan factory is able to offer our  customers shorter lead-times with more convenient service to meet the requirements in middle and north China area.
─HSD Global Net─
At present, HSD has offices in Shenzhen , Beijing , Tianjin, Shanghai, Ningbo, Hangzhou, Guangzhou, Dalian, Nanjin, Hong Kong, Taiwan, Korea, US, UK, Germany, Holland, France, Vietnam, Cambodia, Bangladesh, and Pakistan.  
We will continue to actively expand our business network to meet our customer’s needs.",http://www.hsdzipper.com/,"1,001-5,000 employees",https://media.licdn.com/dms/image/C510BAQHfet0XRLegcA/company-logo_200_200/0?e=1548288000&v=beta&t=iQQ-6QMcw-6t8aZ8nNKUnuHaoZcXdUz90muoRhOe3h8,"Specialize in the manufacture of nylon, plastic and metal zippers.",1991,2657933,70,2018-10-19T09:13:37.557Z,https://www.linkedin.com/company/cmz-zipper/,CMZ Zipper,,"1,001-5,000 employees",https://www.linkedin.com/company/ycc-zippers/,YCC Zippers,,"1,001-5,000 employees",https://www.linkedin.com/company/fujian-sbs-zipper-science&technology-co-ltd-/,"Fujian SBS Zipper Science&Technology Co., Ltd(SBS Headquarters)",,"1,001-5,000 employees",https://www.linkedin.com/company/sab-weixing/,SAB-Weixing,,"10,001+ employees",https://www.linkedin.com/company/tex-corp-ltd./,Tex Corp Ltd.,,none,https://www.linkedin.com/company/kcc-zipper/,KCC ZIPPER LTD,,"1,001-5,000 employees",
https://www.linkedin.com/company/imperva,https://www.linkedin.com/company/imperva,Imperva,Computer & Network Security,"Redwood Shores, CA","Imperva® (NASDAQ:IMPV) is a leading cybersecurity company that delivers best-in-class solutions to protect data and applications – wherever they reside – on-premises, in the cloud, and across hybrid environments. The company’s Incapsula, SecureSphere, and CounterBreach product lines help organizations protect websites, applications, APIs, and databases from cyberattacks while ensuring compliance. Imperva innovates using data, analytics, and insights from our experts and our community to deliver simple, effective and enduring solutions that protect our customers from cybercriminals. Imperva is headquartered in Redwood Shores, California. Learn more: our web site www.imperva.com, our blog www.imperva.com/blog/, on Twitter https://twitter.com/Imperva.",http://www.imperva.com/,"1,001-5,000 employees",https://media.licdn.com/dms/image/C4E0BAQGXuHiI44d5pQ/company-logo_200_200/0?e=1548288000&v=beta&t=UTpOqdGeUqNjbbkOHYZJPU9PGqaM4lMW9CV3tmfY1BY,"Cyber Security, Data Security, Regulatory and Industry Compliance, Application Security, Enterprise Security, Data Center Security, Database Security, File Security, SharePoint Security, Insider Threat Protection, Ransomware Protection, Hybrid IT, Hybrid Cloud, Cloud Security, DDoS Protection, and CDN",2002,14312,1049,2018-10-19T09:13:39.555Z,https://www.linkedin.com/company/incapsula/,Imperva Incapsula,,"1,001-5,000 employees",https://www.linkedin.com/company/palo-alto-networks/,Palo Alto Networks,,"5,001-10,000 employees",https://www.linkedin.com/company/fireeye/,"FireEye, Inc.",,"1,001-5,000 employees",https://www.linkedin.com/company/check-point-software-technologies/,"Check Point Software Technologies, Ltd.",,"1,001-5,000 employees",https://www.linkedin.com/company/fortinet/,Fortinet,,"1,001-5,000 employees",https://www.linkedin.com/company/symantec/,Symantec,,"10,001+ employees",
https://www.linkedin.com/company/infosys,https://www.linkedin.com/company/infosys,Infosys,Information Technology and Services,"Bangalore, Karnataka","Infosys is a global leader in next-generation digital services and consulting. We enable clients in 45 countries to navigate their digital transformation. With over three decades of experience in managing the systems and workings of global enterprises, we expertly steer our clients through the many nexts of their digital journey. We do it by enabling the enterprise with an AI-powered core that helps prioritize the execution of change. We also empower the business with agile digital at scale to deliver unprecedented levels of performance and customer delight. Our always-on learning agenda drives their continuous improvement through building and transferring digital skills, expertise and ideas from our innovation ecosystem.

Visit www.infosys.com to see how Infosys (NYSE: INFY) can help your enterprise navigate your next.",https://www.infosys.com/,"10,001+ employees",https://media.licdn.com/dms/image/C4E0BAQEYgDlNb91L0w/company-logo_200_200/0?e=1548288000&v=beta&t=EtT4RaeDbpTXCjavbdrF4s5CG3rCMPGXW-H7NkS6MXA,"IT Solutions and Services, Consulting, Business Process Outsourcing, Products and Platforms, Engineering Services, Cloud Services, Artificial Intelligence, Digital, and Big Data",1981,1283,212694,2018-10-19T09:13:41.420Z,,,,,,,,,,,,,,,,,,,,,,,,,
https://www.linkedin.com/company/inoutput,https://www.linkedin.com/company/inoutput,inoutput,Computer Software,"Collingwood, Victoria","Inoutput is a full stack software development company. We produce inventive solutions to challenging problems using creative thinking and by producing expertly crafted software. We specialise in web and mobile applications, business automation software and systems development.

At the heart of this is strategy. We believe the foundation of creativity and innovation is careful, critical thinking and a whole lot of old-fashioned hard work.

We are proud of our work and even prouder of our clients. Through conducting respectful collaboration and inviting client participation, we strive to establish lasting and mutually beneficial partnerships with our clients. That way, we share your joy in your success. To that end, we're all in with you and committed to delivering level best at every turn.",http://inoutput.io/,2-10 employees,https://media.licdn.com/dms/image/C4E0BAQGCeL8RNWftPg/company-logo_200_200/0?e=1548288000&v=beta&t=ygue-GkdOl24IVX4rvkcFs9o9sHWgJzQ8eq6sekcVPQ,"Software development, Web development, Mobile development, Systems architecture, Handsomeness, Modesty, Web Application Development, and Business Automation",2013,3007556,5,2018-10-19T09:13:43.264Z,https://www.linkedin.com/company/mod-media-management/,Mod Media Management,,0-1 employees,https://www.linkedin.com/company/modmedia/,ModMedia,,2-10 employees,https://www.linkedin.com/company/essential-appliance-rentals/,Essential Appliance Rentals,,11-50 employees,https://www.linkedin.com/company/passel/,Passel™,,2-10 employees,https://www.linkedin.com/company/vault-enclosures/,VAULT,,11-50 employees,https://www.linkedin.com/company/loyaltycorp/,Loyalty Corp Australia,,51-200 employees,
https://www.linkedin.com/company/intelligent-reach,https://www.linkedin.com/company/intelligent-reach,Intelligent Reach,Computer Software,"London, London","Offsite product discovery (e.g. Google Shopping, Facebook Ads, Amazon) is a vital source of retail revenue, growing by more than 23%* in 2017. Product ads convert 30% higher than conventional advertising and this route to market is set to continue to grow in importance. 

Product data is integral to offsite product success. By powering optimum product data, Intelligent Reach helps retailers & brands optimise the offsite product discovery journey, ensuring no matter when or where your ideal customers interact, they will find your products and convert.",https://www.intelligentreach.com/,11-50 employees,https://media.licdn.com/dms/image/C4D0BAQGnxvxu707CoA/company-logo_200_200/0?e=1548288000&v=beta&t=H3YEmku_rh9pAualEGlPMeBShOTDajKjzzzgypHIVj8,"Performance Marketing, Channel Management, Feed Management, Performance Optimisation, Data Management, and Google Shopping Feeds",2006,2594176,35,2018-10-19T09:13:45.345Z,https://www.linkedin.com/company/stitcherads/,StitcherAds,,11-50 employees,https://www.linkedin.com/company/channeladvisor/,ChannelAdvisor,,"501-1,000 employees",https://www.linkedin.com/company/dream-agility/,Dream Agility,,11-50 employees,https://www.linkedin.com/company/zigzag-global/,ZigZag Global,,11-50 employees,https://www.linkedin.com/company/intelligent-reach-limited/,INTELLIGENT REACH LIMITED,,none,https://www.linkedin.com/company/products-up-gmbh/,Productsup,,51-200 employees,
https://www.linkedin.com/company/interactive-brokers,https://www.linkedin.com/company/interactive-brokers,Interactive Brokers,Financial Services,"Greenwich, Connecticut","Interactive Brokers LLC (IBKR) is a low cost provider of trade execution and clearing services for individuals, advisors, proprietary trading groups, brokers and hedge funds. IBKR’s premier technology provides electronic access to stocks, options, futures, forex, bonds and funds on over 100 markets worldwide from a single IBKR Universal account.

Interactive Brokers Group’s (IBG) headquarters are in Greenwich, CT. IBG has offices throughout the United States, Switzerland, Canada, Hong Kong, the United Kingdom, Australia, Hungary, Russia, India, China and Estonia.

IBLLC is a member of NYSE, FINRA, SIPC. Interactive Brokers Group brokerage affiliates are
regulated by securities and commodities agencies around the world. For more information and
disclosure, please see ibkr.com/info.",http://www.interactivebrokers.com/,"1,001-5,000 employees",https://media.licdn.com/dms/image/C510BAQG5UyXw8Um8hQ/company-logo_200_200/0?e=1548288000&v=beta&t=9Is9B2zuxUqCW7vB0fDBEQv_GxkvV2Cx-cS9DpXE4JE,,,20543,1130,2018-10-19T09:13:47.353Z,https://www.linkedin.com/company/covestor/,Interactive Brokers Asset Management,,11-50 employees,https://www.linkedin.com/company/tradestation-securities/,TradeStation,,201-500 employees,https://www.linkedin.com/company/etrade/,E*TRADE,,"1,001-5,000 employees",https://www.linkedin.com/company/morgan-stanley/,Morgan Stanley,,"10,001+ employees",https://www.linkedin.com/company/goldman-sachs/,Goldman Sachs,,"10,001+ employees",https://www.linkedin.com/company/jpmorgan-chase/,JPMorgan Chase & Co.,,"10,001+ employees",
https://www.linkedin.com/company/intercom,https://www.linkedin.com/company/intercom,Intercom,Computer Software,"San Francisco, California","The world’s first customer platform helping internet businesses accelerate growth.

Thanks to the internet, the way people communicate is drastically different than it was 10, even 5 years ago. Messengers like WhatsApp have become the preferred mode of communication in every aspect of consumers’ lives, and now that switch is happening with businesses too. 

Intercom builds a suite of messaging-first products that all modern internet businesses can use to accelerate growth across the customer lifecycle, from acquisition, to engagement, and support. 

Today more than 25,000 businesses, including New Relic, Sotheby’s, and Shopify, use Intercom to connect with a billion unique people worldwide.",https://www.intercom.com/,201-500 employees,https://media.licdn.com/dms/image/C4E0BAQE4xLpuzTN82g/company-logo_200_200/0?e=1548288000&v=beta&t=E69MwPCOeADNG0gsII2pCQg0H-SoYeaLl3ks3uaKmRQ,"Customer Relationship Management, Customer Engagement, Customer Communication, Live Chat, Customer Support, Customer Feedback, Marketing Automation, Helpdesk, and Mobile",2011,2491343,903,2018-10-19T09:13:49.547Z,https://www.linkedin.com/company/tiny-speck-inc/,Slack,,"1,001-5,000 employees",https://www.linkedin.com/company/stripe/,Stripe,,"1,001-5,000 employees",https://www.linkedin.com/company/intercom_2/,intercom,,11-50 employees,https://www.linkedin.com/company/zendesk/,Zendesk,,"1,001-5,000 employees",https://www.linkedin.com/company/airbnb/,Airbnb,,"1,001-5,000 employees",https://www.linkedin.com/company/google/,Google,,"10,001+ employees",
https://www.linkedin.com/company/intuit,https://www.linkedin.com/company/intuit,Intuit,Computer Software,"Mountain View, CA","Our mission is powering prosperity around the world. We build intuitive web, mobile, and cloud solutions that generate more money, more time, and more confidence for approximately 50 million people. Leveraging big data insights, machine learning, and powerful automation, we help consumers, small business owners, and the self-employed achieve their dreams of prosperity.

Whether you work on our product and technology teams or in any role across the globe, you’ll play a part in designing and launching industry-leading products like Mint, TurboTax and QuickBooks in an agile environment with fast moving teams.  Learn how your ideas will shape our ecosystem of products and make a giant impact.

Our culture and entrepreneurial spirit have earned us a spot on Fortune’s “Best Companies to Work For” year after year, as well as many other recognitions across the globe. Join us in powering prosperity around the world.

Career Areas: Software Engineering, Product Management, Mobile, UX / User Design, Data, QA, IT, Marketing, Sales, Finance, Tax, and more.",http://www.intuit.com/,"5,001-10,000 employees",https://media.licdn.com/dms/image/C4D0BAQFWqsy_AjVJiw/company-logo_200_200/0?e=1548288000&v=beta&t=tGjg_OvsIaTYvoOIGmt7cwYaQ8DZY_wVcwogqJ6jCeo,"Intuit  solves unmet needs that customers would never have dreamed possible.  Whether in the cloud (SaaS/PaaS), mobile, or data, we bring real-world solutions that change the way business is done around the world.",1983,1666,10696,2018-10-19T09:13:51.606Z,https://www.linkedin.com/company/google/,Google,,"10,001+ employees",https://www.linkedin.com/company/amazon/,Amazon,,"10,001+ employees",https://www.linkedin.com/company/microsoft/,Microsoft,,"10,001+ employees",https://www.linkedin.com/company/adobe/,Adobe,,"10,001+ employees",https://www.linkedin.com/company/salesforce/,Salesforce,,"10,001+ employees",https://www.linkedin.com/company/linkedin/,LinkedIn,,"10,001+ employees",
