link,query,name,industry,location,description,website,size,logo,specialities,yearFounded,linkedinID,employeesOnLinkedIn,timestamp,RelatedCompany1LinkedInURL,RelatedCompany1Name,RelatedCompany1Sector,RelatedCompany1EmployeesRange,RelatedCompany2LinkedInURL,RelatedCompany2Name,RelatedCompany2Sector,RelatedCompany2EmployeesRange,RelatedCompany3LinkedInURL,RelatedCompany3Name,RelatedCompany3Sector,RelatedCompany3EmployeesRange,RelatedCompany4LinkedInURL,RelatedCompany4Name,RelatedCompany4Sector,RelatedCompany4EmployeesRange,RelatedCompany5LinkedInURL,RelatedCompany5Name,RelatedCompany5Sector,RelatedCompany5EmployeesRange,RelatedCompany6LinkedInURL,RelatedCompany6Name,RelatedCompany6Sector,RelatedCompany6EmployeesRange,invalidResults
https://www.linkedin.com/company/computershare/,https://www.linkedin.com/company/computershare/,Computershare,Financial Services,"Melbourne, Victoria","Welcome to a world of potential

Computershare can genuinely be considered an Australian success story. From modest beginnings in 1978, we have become the recognised global leader in our field, employing  over 16,000 people in around 90 offices worldwide.

Our success can be attributed to many factors, not least of which is our ability to attract and retain high calibre employees. With a strong focus on delivering certainty, ingenuity and advantage to our clients, we promote an entrepreneurial spirit and an enterprise-wide commitment to service excellence. 

Our diverse portfolio of services and products across our entire group of companies, offers the opportunity to expand your skills, experience and responsibilities across a range of industries both locally and internationally. Opening up a world of potential for you.

If you are looking for that first step or next step in your career, we encourage you to visit careers.computershare.com, or please explore the rest of this site for more information about our business, culture and values.",http://www.computershare.com/,"10,001+ employees",https://media.licdn.com/dms/image/C510BAQF0ZC94tBNXWA/company-logo_200_200/0?e=1548288000&v=beta&t=OHa6_pxq0_nQ_hfYX4m_PNdofkp_XHbLbdTex8v7BZc,"Share Registry, Proxy Solicitation, Entity Management, Board Portal Software, Corporate Actions, Corporate Trust, SEC filings, Deposit Protection, Childcare Vouchers, Bankruptcy administration, Tax voucher solutions, Employee share plans, and Communications Services",1978,"163185,164199",5249,2018-10-19T06:13:37.749Z,https://www.linkedin.com/company/computershare-uk/,Computershare UK,,"1,001-5,000 employees",https://www.linkedin.com/company/computershare-loan-services/,Computershare Loan Services,,"10,001+ employees",https://www.linkedin.com/company/computershare-australia/,Computershare Australia,,"1,001-5,000 employees",https://www.linkedin.com/company/computershare-canada/,Computershare Canada,,"1,001-5,000 employees",https://www.linkedin.com/company/computershare-us/,Computershare U.S.,,"10,001+ employees",https://www.linkedin.com/company/computershare-hong-kong/,Computershare Hong Kong,,"10,001+ employees",
https://www.linkedin.com/company/vanguard-australia/,https://www.linkedin.com/company/vanguard-australia/,Vanguard Australia,Financial Services,"Southbank, Victoria","Vanguard Australia has been helping investors achieve their long-term financial goals for over 20 years. With more than AUD $5.9 trillion in assets under management as of 30 September 2017, including over AUD $1 trillion in ETFs, Vanguard is one of the world’s largest global investment management companies. 

We partner with institutional clients, financial advisers and individuals to offer investment solutions that are low-cost, diversified and robust through time. Our comprehensive range of managed funds, exchange traded funds (ETFs) and tailored investment solutions are all built to support long-term investment success for our clients. 

Rather than being publicly traded or owned by a small group of individuals, The Vanguard Group is owned by Vanguard's U.S.-domiciled funds and ETFs. Those funds, in turn, are owned by their investors.  In Australia, Vanguard leverages the scale, experience and resources of our established global business. Vanguard's ownership structure means that our clients don't have to worry that we'll be acquired. The company they invest with today will continue to serve them in the future. 

With no other parties to answer to, we can  keep costs low and we can make every decision solely with investors'​ interests in mind.",http://www.vanguard.com.au/,201-500 employees,https://media.licdn.com/dms/image/C4E0BAQHUlgAPdS8wFA/company-logo_200_200/0?e=1548288000&v=beta&t=cX9DdBDMga2mDTF0ht1UQS7u078hCz8SgBPxDDSkBTc,"Investment, ETFs (Exchange Traded Funds), Retirement, Managed Funds, Indexing, Self Managed Super Funds (SMSFs), and Active investment management",1996,3183,306,2018-10-19T06:13:39.876Z,https://www.linkedin.com/company/vanguard/,Vanguard,,"10,001+ employees",https://www.linkedin.com/company/blackrock/,BlackRock,,"10,001+ employees",https://www.linkedin.com/company/cbus-super-fund/,Cbus Super Fund,,201-500 employees,https://www.linkedin.com/company/australiansuper/,AustralianSuper,,201-500 employees,https://www.linkedin.com/company/national-australia-bank/,National Australia Bank,,"10,001+ employees",https://www.linkedin.com/company/macquariegroup/,Macquarie Group,,"10,001+ employees",
https://www.linkedin.com/company/aston-carter/,https://www.linkedin.com/company/aston-carter/,Aston Carter,Staffing and Recruiting,,"Aston Carter is a distinguished global provider of recruitment and staffing services to companies requiring highly specialised business professionals. We have an unrivalled commitment to delivering first class service to clients and business professionals across a variety of business disciplines, including Accounting and Finance, Change and Transformation, Compliance, Management Consultancy, Operations , and Risk and Regulation. With more than 60 offices across Europe, Asia Pacific and North America, Aston Carter provides local, regional and global expertise to drive value and meet our client’s unique needs. Aston Carter is part of Allegis Group, a global talent solutions provider.",http://www.astoncarter.com/,"1,001-5,000 employees",https://media.licdn.com/dms/image/C510BAQFFQXRHfhBinw/company-logo_200_200/0?e=1548288000&v=beta&t=l-AgJ_2Rr5be5KpMVxr2-b9vGSaApSublKZBkN6kmNY,"Accounting and Finance, Business Support, Strategy, Change & Transformation, Operations, Audit, Risk & Compliance, Banking and Financial Services, Human Resources (APAC only), and Sales, Marketing, Communications & Digital (APAC only)",1997,"13153,2154",911,2018-10-19T06:13:41.733Z,https://www.linkedin.com/company/allegis-group/,Allegis Group,,"10,001+ employees",https://www.linkedin.com/company/aerotek/,Aerotek,,"5,001-10,000 employees",https://www.linkedin.com/company/hays/,Hays,,"5,001-10,000 employees",https://www.linkedin.com/company/teksystems/,TEKsystems,,"1,001-5,000 employees",https://www.linkedin.com/company/allegis-global-solutions/,Allegis Global Solutions,,"1,001-5,000 employees",https://www.linkedin.com/company/robert-walters/,Robert Walters,,"1,001-5,000 employees",
https://www.linkedin.com/company/whitbread/,https://www.linkedin.com/company/whitbread/,Whitbread,Hospitality,"Houghton Regis, Dunstable","We’re the UK’s biggest hospitality company and the owners of much-loved brands, including Premier Inn, hub by Premier Inn, Costa Coffee, Brewers Fayre, Beefeater Grill and Table Table.

We fundamentally believe that our success is down to our 50,000 motivated and highly engaged team members. They deliver outstanding service to over 28 million customers every month across our UK hotels, coffee shops and restaurants.

Over the past five years we have created 15,000 UK jobs by adding over 130 more hotels, nearly 100 restaurants and more than 1,500 coffee shops. We now have over 2,000 outlets in the UK and are rapidly increasing our international presence. 

Our 2020 milestones are to increase the number of Premier Inn UK rooms to around 85,000 and to achieve global system sales of around £2.5 bn for Costa. With this we plan to create around 3,000 UK jobs each year, and as we expand our global presence, we’ll also create thousands more jobs overseas too.

OUR VISION:  
We will grow legendary brands by building a strong customer heartbeat and innovating to stay ahead. Our winning teams make everyday experiences special for customers, so they come back time and again, driving profitable growth.

OUR VALUES:  
Our values underpin everything we do at Whitbread, across all our brands:
•	Genuine - we really care about customers
•	Confident - we strive to be the best at what we do
•	Committed - we work hard for each other

Whilst our core business has changed over the years, we remain true to Samuel Whitbread’s founding spirit to put our people first, focus on the customer, and recognise that progress comes from innovative thinking. 

Visit our website at www.whitbread.co.uk for more information, career opportunities and to learn about our Sustainability programme, which we call ‘Force for Good’.",http://www.whitbread.co.uk/,"10,001+ employees",https://media.licdn.com/dms/image/C560BAQEGCWchhGus5A/company-logo_200_200/0?e=1548288000&v=beta&t=CZQmBiCBULZOqINBU9O7_UkdPkFDOesS3lIdr05bFqQ,"Hospitality, Coffee, Food, Corporate responsibility, and Hotels",1742,"9395,843571,680485",15389,2018-10-19T06:13:43.543Z,https://www.linkedin.com/company/costa-coffee/,Costa Coffee,,"10,001+ employees",https://www.linkedin.com/company/premier-inn/,Premier Inn,,"10,001+ employees",https://www.linkedin.com/company/mitchells-&-butlers/,Mitchells & Butlers PLC,,"10,001+ employees",https://www.linkedin.com/company/starbucks/,Starbucks,,"10,001+ employees",https://www.linkedin.com/company/greeneking/,Greene King,,"10,001+ employees",https://www.linkedin.com/company/pret-a-manger/,Pret A Manger,,"5,001-10,000 employees",
https://www.linkedin.com/company/city-of-canterbury-bankstown/,https://www.linkedin.com/company/city-of-canterbury-bankstown/,City of Canterbury Bankstown,Government Administration,"Bankstown, NSW","The new City of Canterbury Bankstown was formed on 12 May 2016. The City of Canterbury Bankstown is home to 350,000 residents, making us the most populous Council in NSW.

Located less than 20 kilometres south-west of the Sydney CBD, the City of Canterbury Bankstown has a diverse multicultural community and prides itself on providing an excellent service to the community, with a commitment to remain a leader in local government.

At Council, we are dedicated to being an innovative, progressive, diverse, and award-winning organisation which is driven by the people we have working for us.

To find out more on what we have to offer you and our current vacancies, please visit our website as detailed below.

www.facebook.com/ourcbcity
twitter.com/ourcbcity 
www.instagram.com/ourcbcity",https://www.cbcity.nsw.gov.au/,"1,001-5,000 employees",https://media.licdn.com/dms/image/C560BAQHI2wAkAX--HQ/company-logo_200_200/0?e=1548288000&v=beta&t=5PQVUgKxXuyLHKuDmlQd7AYxr3i9g_s-IFd1ELpa4Bw,,,1537530,425,2018-10-19T06:13:45.367Z,https://www.linkedin.com/company/parramatta-city-council/,City of Parramatta,,"501-1,000 employees",https://www.linkedin.com/company/penrith-city-council/,Penrith City Council,,"1,001-5,000 employees",https://www.linkedin.com/company/city-of-sydney/,City of Sydney,,"1,001-5,000 employees",https://www.linkedin.com/company/inner-west-council/,Inner West Council,,"1,001-5,000 employees",https://www.linkedin.com/company/blacktown-city-council/,Blacktown City Council,,"1,001-5,000 employees",https://www.linkedin.com/company/fairfield-city-council/,Fairfield City Council,,"501-1,000 employees",
https://www.linkedin.com/company/trusted-advisor-network-canberra/,https://www.linkedin.com/company/trusted-advisor-network-canberra/,Trusted Advisor Network - Canberra,Management Consulting,"Evatt, Australian Capital Territory","Natalie Sammons is a proud member of the Trusted Advisor Network (TAN), a unique group of passionate business advisors around Australia and New Zealand.  As a Regional Director she is looking to recruit passionate business people with great backgrounds to operate as Business Advisors around Canberra and South Eastern NSW.  Within two years of changing her career focus and joining TAN,  She helps business owners through her Group and Premium Client Programs and has seen how her experience, coupled with The TAN System can help other business owners to play a bigger game.",https://trustedadvisor.co/consultant-opportunity-act-se-nsw/,0-1 employees,https://media.licdn.com/dms/image/C560BAQGscWwuOydKpg/company-logo_200_200/0?e=1548288000&v=beta&t=QFgfAbaLd-bezhFMXBZ3emLwP4iPQNr0DO9ZBU0--X8,,,18721170,1,2018-10-19T06:13:46.856Z,https://www.linkedin.com/company/department-of-premier-and-cabinet-nsw-/,Department of Premier and Cabinet (NSW),,"501-1,000 employees",,,,,,,,,,,,,,,,,,,,,
https://www.linkedin.com/company/indigenous-business-australia/,https://www.linkedin.com/company/indigenous-business-australia/,Indigenous Business Australia,Financial Services,"MAJURA PARK  , Australian Capital Territory","Indigenous Business Australia (IBA) is a progressive, commercially focused organisation that promotes and encourages self-management, self-sufficiency and economic independence for Aboriginal and Torres Strait Islander peoples.

We identify and pursue opportunities that enable Indigenous Australians to create wealth, accumulate assets and achieve their financial aspirations. We do this by building mutually respectful and responsible partnerships with Indigenous Australians, government agencies, private sector business and industry to facilitate:

home ownership 
business ownership 
wealth creating investments.",http://iba.gov.au/,201-500 employees,https://media.licdn.com/dms/image/C4D0BAQEUlVNFz4AoVw/company-logo_200_200/0?e=1548288000&v=beta&t=FzVCg3fzmuRaXIA53PP-n-g1bBb3ZL_T9a5FcDvOKD4,"Equity Investments, Home Loans, Enterprises Loans, Strategic Partnerships, and Leases",2001,2088163,203,2018-10-19T06:13:48.677Z,https://www.linkedin.com/company/national-centre-of-indigenous-excellence/,The National Centre of Indigenous Excellence (NCIE),,51-200 employees,https://www.linkedin.com/company/indigenous-land-corporation/,Indigenous Land Corporation,,51-200 employees,https://www.linkedin.com/company/supply-nation/,Supply Nation,,11-50 employees,https://www.linkedin.com/company/aime/,AIME,,51-200 employees,https://www.linkedin.com/company/northern-land-council/,Northern Land Council,,51-200 employees,https://www.linkedin.com/company/australian-indigenous-education-foundation/,Australian Indigenous Education Foundation (AIEF),,11-50 employees,
https://www.linkedin.com/company/department-of-economic-development-jobs-transport-and-resources/,https://www.linkedin.com/company/department-of-economic-development-jobs-transport-and-resources/,"Department of Economic Development, Jobs, Transport and Resources",Government Administration,"Melbourne, Victoria","The Department of Economic Development, Jobs, Transport and Resources (DEDJTR) works to improve the lives and prosperity of all Victorians.

Our mission is to get our economy and society working together for the benefit of all Victorians – by creating more jobs for more people, connecting people and businesses, and maintaining Victoria's envied reputation for liveability now, and for the future.

Our role is to increase jobs, investment, exports and opportunities; stimulate innovation, competitiveness, and confidence; and support sustainability. 

We have nine ministers across 14 portfolios:  Agriculture; Creative Industries; Industrial Relations; Industry and Employment; Innovation and the Digital Economy; Major Projects; Regional Development; Resources; Roads and Road Safety; Ports; Public Transport; Small Business; Tourism and Major Events; and Trade and Investment. . 

Two enabling groups provide department-wide operational support: Strategy and Planning and Corporate Services. Our employees are located throughout the Melbourne central business district, metropolitan Melbourne, regional Victoria and international offices. Additional information about the department can be found on our website: economicdevelopment.vic.gov.au .",http://www.economicdevelopment.vic.gov.au/,"1,001-5,000 employees",https://media.licdn.com/dms/image/C4D0BAQFxqn2yRzeyow/company-logo_200_200/0?e=1548288000&v=beta&t=fXVWbsbrkhiiOEk11kfA5rkB3gj5IoLW06rj3IGd4Xs,,2015,4864792,1452,2018-10-19T06:13:50.801Z,https://www.linkedin.com/company/department-of-justice-victoria-australia/,"Department of Justice and Regulation, Victoria, Australia",,"5,001-10,000 employees",https://www.linkedin.com/company/department-of-environment-land-water-&-planning/,"Department of Environment, Land, Water and Planning",,"1,001-5,000 employees",https://www.linkedin.com/company/educationvic/,"Department of Education & Training, Victoria",,"10,001+ employees",https://www.linkedin.com/company/department-of-human-services-victoria-australia/,"Department of Health & Human Services, Victoria",,"10,001+ employees",https://www.linkedin.com/company/vicotrian-government/,Victorian Government,,201-500 employees,https://www.linkedin.com/company/department-of-premier-and-cabinet-vic-/,Department of Premier and Cabinet (Vic),,"501-1,000 employees",
https://www.linkedin.com/company/bgl-corporate-solutions/,https://www.linkedin.com/company/bgl-corporate-solutions/,BGL Corporate Solutions,Information Technology and Services,"Brighton East, Victoria","BGL is Australia’s leading developer of SMSF administration and ASIC corporate compliance software solutions. BGL cloud solutions include Simple Fund 360, Australia’s leading cloud SMSF administration software solution and CAS 360, the next generation cloud ASIC corporate compliance software solution.

BGL desktop solutions include Simple Fund, Australia’s leading cloud SMSF administration software solution used to administer over 75% of SMSFs. 

CAS, the world's leading corporate compliance software solution and Simple Ledger, a simple double entry general ledger accounting software solution. BGL. Your partner in compliance. 

Website: www.bglcorp.com 
Twitter: https://twitter.com/bgldot 
LinkedIn: http://bit.ly/BGLdot 
Facebook: https://www.facebook.com/BGLCorp",http://www.bglcorp.com/,51-200 employees,https://media.licdn.com/dms/image/C4E0BAQEQgbh1vAzKjw/company-logo_200_200/0?e=1548288000&v=beta&t=BSP9FJjlYfXgpvvQQAqrIm6qACMeSByUvDQWZ-Tg3Ag,"Compliance Software, Accounting, Corporate Compliance, SMSF Specialists, Company Compliance, SMSF Cloud Softare, SMSF Administration, General Ledger Accounting, SMSF Compliance, Self Managed Super Fund, SMSF Software, Self Managed Super Fund Software, and SMSF",1983,218580,112,2018-10-19T06:13:52.724Z,https://www.linkedin.com/company/bgl-group/,BGL Group,,"1,001-5,000 employees",https://www.linkedin.com/company/classlimited/,Class Ltd,,51-200 employees,https://www.linkedin.com/company/xero/,Xero,,"1,001-5,000 employees",https://www.linkedin.com/company/bgl-group-inc./,BGL Group Inc.,,11-50 employees,https://www.linkedin.com/company/topdocs-pty-ltd/,Topdocs Pty Ltd,,11-50 employees,https://www.linkedin.com/company/telstra/,Telstra,,"10,001+ employees",
https://www.linkedin.com/company/finite-it-recruitment-solutions/,https://www.linkedin.com/company/finite-it-recruitment-solutions/,Finite IT Recruitment Solutions,Staffing and Recruiting,"Sydney, NSW","100% Australian owned, Finite is ANZ’s leading Technology, Digital and Business Transformation specialist recruiter with nine established ANZ offices. Whether you’re an employer looking for talent, or an ICT professional looking to take the next step in your career, we can help. 

How? 

1. We match talent to opportunity.
2. We align expertise with challenge.
3. We connect great people.

Finite was established in 1998, by Managing Director, Tracy Thomson who created a company that offered specialist recruitment expertise to Information Technology jobseekers and employers. 

Since then, the business has grown considerably and is now acknowledged as a market leader, with six offices across Australia and two in New Zealand.

Our passionate team of people are driven to provide great outcomes for our diverse client base. Our culture celebrates success and the individual entrepreneurship that is woven into our DNA.

Finite has won numerous industry awards which we are proud of including: 

3 x BRW magazine ’50 Best Places to Work’ for three consecutive years
2 x REA Deloitte Recruitment Excellence Award for Best Business Management 
ABA 100 Australian Business Awards in 2015, 2017 and 2018
“Australia’s Favourite Large IT Recruiter” by SEEK 
""Best IT Recruitment Firm 2016 - Australia""​ 
""Best Technology Recruiter - 2017""​ by CV Magazine
Global Recruiter's Asia Pacific Best Specialist Recruitment Business in 2017

We go through a lot of champagne…

If you need quality technology, digital or business transformation talent, we can help.

Get in touch with us today, and help us connect you with great people.",http://www.finite.com.au/,51-200 employees,https://media.licdn.com/dms/image/C4D0BAQEFxzMz_lxLVg/company-logo_200_200/0?e=1548288000&v=beta&t=fPzeQozHGOGvun0WpkET9e62FVvC6z-9EzdYQOc_c7U,"Banking & Finance, Telecommunications, Government (Federal, State & Local), ICT Vendors, Digital Media, Transport, Education, Health & Pharmaceuticals, Energy, Resources & Utilities, Not for Profit, Supply Chain & Logistics, and FMCG.",1998,40410,144,2018-10-19T06:13:54.593Z,https://www.linkedin.com/company/peoplebank/,Peoplebank,,201-500 employees,https://www.linkedin.com/company/paxus/,Paxus - Technology + Digital Talent,,51-200 employees,https://www.linkedin.com/company/clicks-it-recruitment/,Clicks IT Recruitment,,51-200 employees,https://www.linkedin.com/company/finxl-it-professional-services/,FinXL IT Professional Services,,201-500 employees,https://www.linkedin.com/company/talent-international/,Talent,,201-500 employees,https://www.linkedin.com/company/genesis-it/,Genesis Recruitment Solutions,,11-50 employees,
https://www.linkedin.com/company/pacpartners/,https://www.linkedin.com/company/pacpartners/,PacPartners,Management Consulting,"Melbourne, Victoria","Operating as a specialist part of Pacific Search Partners, and established in 2016, PacPartners is a niche executive recruitment offering for roles that fall below C-suite and Non-Executive Director level. It provides an avenue to recruit both Permanent and Contract/Interim resources into public and private interest entities.

PacPartners provides for advertised executive recruitment leveraging off our nationally recognised brand and the personal network of our experienced consultants. In addition to online job boards, we attract high calibre talent pools with a range of social media applications and traditional press advertising where appropriate.

Providing flexibility and a bespoke experience to our clients is imperative – this allows us to combine an active recruitment program with proprietary database searches as appropriate to each individual role. Our methodology is disciplined, thorough, confidential and professional. From our initial client briefing through to the negotiation of an accepted offer and beyond, we are transparent and ethical to the fullest degree.",http://pacificsearch.com.au/pacpartners/,2-10 employees,https://media.licdn.com/dms/image/C4E0BAQFOuss7jhW9mQ/company-logo_200_200/0?e=1548288000&v=beta&t=7cpeRO8-7WJo9U-ZaXT2h3G0se_YnQ7wn4SIO3d7U9Y,"Accounting & Finance, Marketing, Sales & Business Development, Human Resources, IT & Project Management, and Office Support",2016,,,2018-10-19T06:13:56.217Z,https://www.linkedin.com/company/second-law/,Second Law,,2-10 employees,https://www.linkedin.com/company/bold-discovery/,Bold Discovery,,2-10 employees,https://www.linkedin.com/company/pacific-search-partners/,Pacific Search Partners,,2-10 employees,https://www.linkedin.com/company/roller/,ROLLER,,51-200 employees,https://www.linkedin.com/company/blind-ferret-entertainment/,Blind Ferret,,11-50 employees,https://www.linkedin.com/company/mango-communications/,Mango Communications,,11-50 employees,
